QUESTIONS,ANSWER,LOD,TRANSLATION,FRUIT,CATEGORY
"Be careful for nothing. but in everything by prayer & supplication, with thanksgiving, let your requests be made known unto god. ANd the peace of god which surpasses all understanding shall keep your hearts & minds through christ jesus.",Phillippians 4:6-7,Intermediate,KJV,Peace,
"Peace I leave with you, my peace I give unto you: not as the world giveth, give I unto you. Let not your heart be troubled, neither let it be afraid.",John 14:27,Easy,KJV,Peace,
"Thou wilt keep him in perfect peace, whose mind is stayed on thee: because he trusteth in thee.",Isaiah 26:3,Easy,KJV,Peace,
Now the Lord of peace himself give you peace always by all means. The Lord be with you all.,2 Thessalonians 3:16,Easy,KJV,Peace,
"I will both lay me down in peace, and sleep: for thou, Lord, only makest me dwell in safety.",Psalm 4:8,Easy,KJV,Peace,
"Therefore being justified by faith, we have peace with God through our Lord Jesus Christ.",Romans 5:1,Intermediate,KJV,Peace,
"And let the peace of God rule in your hearts, to the which also ye are called in one body; and be ye thankful.",Colossians 3:15,Intermediate,KJV,Peace,
"Depart from evil, and do good. seek peace, and pursue it.",Psalm 34:14,Easy,KJV,Peace,
"When a man's ways please the Lord, he maketh even his enemies to be at peace with him.",Proverbs 16:7,Intermediate,KJV,Peace,
"Then said Jesus to them again, Peace be unto you: as my Father hath sent me, even so send I you.",John 20:21,Intermediate,KJV,Peace,
"And he arose, and rebuked the wind, and said unto the sea, Peace, be still. And the wind ceased, and there was a great calm.",Mark 4:39,Difficult,KJV,Peace,
Blessed are the peacemakers: for they shall be called the children of God.,Matthew 5:9,Easy,KJV,Peace,
"Follow peace with all men, and holiness, without which no man shall see the Lord.",Hebrews 12:14,Intermediate,KJV,Peace,
"For God is not the author of confusion, but of peace, as in all churches of the saints.",1 Corinthians 14:33,Intermediate,KJV,Peace,
"But the wisdom that is from above is first pure, then peaceable, gentle, and easy to be intreated, full of mercy and good fruits, without partiality, and without hypocrisy.",James 3:17,Difficult,KJV,Peace,
For to be carnally minded is death; but to be spiritually minded is life and peace.,Romans 8:6,Easy,KJV,Peace,
The Lord will give strength unto his people; the Lord will bless his people with peace.,Psalm 29:11,Easy,KJV,Peace,
"If it be possible, as much as lieth in you, live peaceably with all men.",Romans 12:18,Easy,KJV,Peace,